{
  "$schema": "./request.schema.json",
  "backup_name": "full-machine-ssd-migration",
  "require_elevation": true,
  "sources": [
    {
      "name": "home-projects",
      "path": "~/Projects",
      "enabled": true,
      "respect_gitignore": true,
      "follow_symlinks": false,
      "include": [
        "**"
      ],
      "exclude": [
        "**/.git/**",
        "**/node_modules/**",
        "**/target/**",
        "**/.venv/**",
        "**/dist/**",
        "**/build/**",
        "**/.ruff_cache/**",
        "**/__pycache__/**",
        "**/.pytest_cache/**",
        "**/.mypy_cache/**"
      ],
      "force_include": [
        ".env",
        ".env.*",
        "**/.env",
        "**/.env.*"
      ],
      "path_regex_include": [],
      "path_regex_exclude": [],
      "content_regex_include": [],
      "content_regex_exclude": [],
      "content_encoding": "utf-8"
    },
    {
      "name": "devspace-projects",
      "path": "/mnt/devspace/Projects",
      "enabled": true,
      "respect_gitignore": true,
      "follow_symlinks": false,
      "include": [
        "**"
      ],
      "exclude": [
        "**/.git/**",
        "**/node_modules/**",
        "**/target/**",
        "**/.venv/**",
        "**/dist/**",
        "**/build/**",
        "**/data/services/**",
        "**/.ruff_cache/**",
        "**/__pycache__/**",
        "**/.pytest_cache/**",
        "**/.mypy_cache/**"
      ],
      "force_include": [
        ".env",
        ".env.*",
        "**/.env",
        "**/.env.*"
      ],
      "path_regex_include": [],
      "path_regex_exclude": [],
      "content_regex_include": [],
      "content_regex_exclude": [],
      "content_encoding": "utf-8"
    },
    {
      "name": "devspace-trade-plus",
      "path": "/mnt/devspace/trade_plus",
      "enabled": true,
      "respect_gitignore": true,
      "follow_symlinks": false,
      "include": [
        "**"
      ],
      "exclude": [
        "**/.git/**",
        "**/node_modules/**",
        "**/target/**",
        "**/.venv/**",
        "**/.dbdata/**",
        "**/.dbgate/**",
        "**/.ruff_cache/**",
        "**/__pycache__/**"
      ],
      "force_include": [
        ".env",
        ".env.*",
        "**/.env",
        "**/.env.*"
      ],
      "path_regex_include": [],
      "path_regex_exclude": [],
      "content_regex_include": [],
      "content_regex_exclude": [],
      "content_encoding": "utf-8"
    },
    {
      "name": "devspace-kiro-bot",
      "path": "/mnt/devspace/Kiro_Bot_V8_Final_E2E",
      "enabled": true,
      "respect_gitignore": true,
      "follow_symlinks": false,
      "include": [
        "**"
      ],
      "exclude": [
        "**/.git/**",
        "**/node_modules/**",
        "**/__pycache__/**",
        "**/.ruff_cache/**",
        "**/output*/**",
        "**/docker-output/**"
      ],
      "force_include": [
        ".env",
        ".env.*",
        "**/.env",
        "**/.env.*"
      ],
      "path_regex_include": [],
      "path_regex_exclude": [],
      "content_regex_include": [],
      "content_regex_exclude": [],
      "content_encoding": "utf-8"
    },
    {
      "name": "devspace-home-data",
      "path": "/mnt/devspace/home-data",
      "enabled": true,
      "respect_gitignore": false,
      "follow_symlinks": false,
      "include": [
        "**"
      ],
      "exclude": [
        "**/.git/**",
        "**/cache/**",
        "**/*.sock",
        "**/.ruff_cache/**",
        "**/__pycache__/**"
      ],
      "force_include": [
        ".env",
        ".env.*",
        "**/.env",
        "**/.env.*"
      ],
      "path_regex_include": [],
      "path_regex_exclude": [],
      "content_regex_include": [],
      "content_regex_exclude": [],
      "content_encoding": "utf-8"
    },
    {
      "name": "home-anchor-backup",
      "path": "~/Anchor-backup",
      "enabled": true,
      "respect_gitignore": false,
      "follow_symlinks": false,
      "include": [
        "**"
      ],
      "exclude": [
        "**/node_modules/**",
        "**/__pycache__/**",
        "**/.ruff_cache/**"
      ],
      "force_include": [
        ".env",
        ".env.*",
        "**/.env",
        "**/.env.*"
      ],
      "path_regex_include": [],
      "path_regex_exclude": [],
      "content_regex_include": [],
      "content_regex_exclude": [],
      "content_encoding": "utf-8"
    },
    {
      "name": "home-anchor-licenses",
      "path": "~/anchor-licenses",
      "enabled": true,
      "respect_gitignore": false,
      "follow_symlinks": false,
      "include": [
        "**"
      ],
      "exclude": [],
      "force_include": [
        ".env",
        ".env.*",
        "**/.env",
        "**/.env.*"
      ],
      "path_regex_include": [],
      "path_regex_exclude": [],
      "content_regex_include": [],
      "content_regex_exclude": [],
      "content_encoding": "utf-8"
    },
    {
      "name": "home-documents",
      "path": "~/Documents",
      "enabled": true,
      "respect_gitignore": false,
      "follow_symlinks": false,
      "include": [
        "**"
      ],
      "exclude": [
        "**/__pycache__/**",
        "**/.ruff_cache/**",
        "**/node_modules/**"
      ],
      "force_include": [
        ".env",
        ".env.*",
        "**/.env",
        "**/.env.*"
      ],
      "path_regex_include": [],
      "path_regex_exclude": [],
      "content_regex_include": [],
      "content_regex_exclude": [],
      "content_encoding": "utf-8"
    },
    {
      "name": "home-desktop",
      "path": "~/Desktop",
      "enabled": true,
      "respect_gitignore": false,
      "follow_symlinks": false,
      "include": [
        "**"
      ],
      "exclude": [],
      "force_include": [
        ".env",
        ".env.*",
        "**/.env",
        "**/.env.*"
      ],
      "path_regex_include": [],
      "path_regex_exclude": [],
      "content_regex_include": [],
      "content_regex_exclude": [],
      "content_encoding": "utf-8"
    },
    {
      "name": "home-pictures",
      "path": "~/Pictures",
      "enabled": true,
      "respect_gitignore": false,
      "follow_symlinks": false,
      "include": [
        "**"
      ],
      "exclude": [],
      "force_include": [
        ".env",
        ".env.*",
        "**/.env",
        "**/.env.*"
      ],
      "path_regex_include": [],
      "path_regex_exclude": [],
      "content_regex_include": [],
      "content_regex_exclude": [],
      "content_encoding": "utf-8"
    },
    {
      "name": "home-secrets",
      "path": "~/Secrets",
      "enabled": true,
      "respect_gitignore": false,
      "follow_symlinks": false,
      "include": [
        "**"
      ],
      "exclude": [],
      "force_include": [
        ".env",
        ".env.*",
        "**/.env",
        "**/.env.*"
      ],
      "path_regex_include": [],
      "path_regex_exclude": [],
      "content_regex_include": [],
      "content_regex_exclude": [],
      "content_encoding": "utf-8"
    },
    {
      "name": "home-opencode-work",
      "path": "~/opencode",
      "enabled": true,
      "respect_gitignore": true,
      "follow_symlinks": false,
      "include": [
        "**"
      ],
      "exclude": [
        "**/.git/**",
        "**/node_modules/**",
        "**/target/**",
        "**/.venv/**",
        "**/dist/**",
        "**/build/**",
        "**/.ruff_cache/**",
        "**/__pycache__/**",
        "**/.pytest_cache/**",
        "**/.mypy_cache/**"
      ],
      "force_include": [
        ".env",
        ".env.*",
        "**/.env",
        "**/.env.*"
      ],
      "path_regex_include": [],
      "path_regex_exclude": [],
      "content_regex_include": [],
      "content_regex_exclude": [],
      "content_encoding": "utf-8"
    },
    {
      "name": "home-forge-backup",
      "path": "~/forge_backup",
      "enabled": true,
      "respect_gitignore": false,
      "follow_symlinks": false,
      "include": [
        "**"
      ],
      "exclude": [
        "**/.git/**",
        "**/node_modules/**",
        "**/__pycache__/**",
        "**/.ruff_cache/**",
        "**/.pytest_cache/**",
        "**/.mypy_cache/**"
      ],
      "force_include": [
        ".env",
        ".env.*",
        "**/.env",
        "**/.env.*"
      ],
      "path_regex_include": [],
      "path_regex_exclude": [],
      "content_regex_include": [],
      "content_regex_exclude": [],
      "content_encoding": "utf-8"
    },
    {
      "name": "home-forge-backup-offhost",
      "path": "~/forge_backup_offhost",
      "enabled": true,
      "respect_gitignore": false,
      "follow_symlinks": false,
      "include": [
        "**"
      ],
      "exclude": [
        "**/.git/**",
        "**/node_modules/**",
        "**/__pycache__/**",
        "**/.ruff_cache/**",
        "**/.pytest_cache/**",
        "**/.mypy_cache/**"
      ],
      "force_include": [
        ".env",
        ".env.*",
        "**/.env",
        "**/.env.*"
      ],
      "path_regex_include": [],
      "path_regex_exclude": [],
      "content_regex_include": [],
      "content_regex_exclude": [],
      "content_encoding": "utf-8"
    },
    {
      "name": "home-dsalearn",
      "path": "~/dsalearn",
      "enabled": true,
      "respect_gitignore": true,
      "follow_symlinks": false,
      "include": [
        "**"
      ],
      "exclude": [
        "**/.git/**",
        "**/node_modules/**",
        "**/target/**",
        "**/.venv/**",
        "**/dist/**",
        "**/build/**",
        "**/.ruff_cache/**",
        "**/__pycache__/**",
        "**/.pytest_cache/**",
        "**/.mypy_cache/**"
      ],
      "force_include": [
        ".env",
        ".env.*",
        "**/.env",
        "**/.env.*"
      ],
      "path_regex_include": [],
      "path_regex_exclude": [],
      "content_regex_include": [],
      "content_regex_exclude": [],
      "content_encoding": "utf-8"
    },
    {
      "name": "home-sdlearn",
      "path": "~/sdlearn",
      "enabled": true,